{
  "taskId": "task-1",
  "agentId": "agent-1",
  "timestamp": "2026-06-30T16:10:00Z",
  "status": "PASS",
  "planned_change": "Implement harmless configuration change",
  "actual_change": "Created config.txt with harmless key-value pair",
  "verification_command": "cat config.txt",
  "evidence_file": "evidence/task-1_verify.log",
  "prevention": "Ensured mock parameters are read-only in secondary logic."
}
